{
  "ok": true,
  "submission_dir": "submissions\\Jackeyhate9\\jingzhang-ai-double-helix",
  "pr_author": "Jackeyhate9",
  "stage": "formal",
  "deterministic_validation": {
    "returncode": 0,
    "ok": true,
    "stdout": {
      "ok": true,
      "errors": [],
      "warnings": [
        "submissions/Jackeyhate9/jingzhang-ai-double-helix/geometry/site_boundary.geojson: uses provisional boundary; do not treat it as an official redline or precise-area basis. Organizer data gaps do not block content scoring; recalculate when official geometry is supplied"
      ],
      "proposal_files": [
        "submissions/Jackeyhate9/jingzhang-ai-double-helix/proposal.md"
      ],
      "changelog_files": [],
      "changed_files": [
        "submissions/Jackeyhate9/jingzhang-ai-double-helix/agent.json",
        "submissions/Jackeyhate9/jingzhang-ai-double-helix/assets/figures/key-areas.png",
        "submissions/Jackeyhate9/jingzhang-ai-double-helix/assets/figures/land-use-structure.png",
        "submissions/Jackeyhate9/jingzhang-ai-double-helix/assets/figures/metrics-evidence.png",
        "submissions/Jackeyhate9/jingzhang-ai-double-helix/assets/figures/mobility-bluegreen.png",
        "submissions/Jackeyhate9/jingzhang-ai-double-helix/assets/figures/site-overview.png",
        "submissions/Jackeyhate9/jingzhang-ai-double-helix/assumptions.json",
        "submissions/Jackeyhate9/jingzhang-ai-double-helix/compliance_matrix.json",
        "submissions/Jackeyhate9/jingzhang-ai-double-helix/design_depth_matrix.json",
        "submissions/Jackeyhate9/jingzhang-ai-double-helix/drawings/a0-boards.en.pdf",
        "submissions/Jackeyhate9/jingzhang-ai-double-helix/drawings/a0-boards.pdf",
        "submissions/Jackeyhate9/jingzhang-ai-double-helix/drawings/a3-booklet.en.pdf",
        "submissions/Jackeyhate9/jingzhang-ai-double-helix/drawings/a3-booklet.pdf",
        "submissions/Jackeyhate9/jingzhang-ai-double-helix/geometry/buildings.geojson",
        "submissions/Jackeyhate9/jingzhang-ai-double-helix/geometry/constraints.geojson",
        "submissions/Jackeyhate9/jingzhang-ai-double-helix/geometry/green_space.geojson",
        "submissions/Jackeyhate9/jingzhang-ai-double-helix/geometry/key_areas.geojson",
        "submissions/Jackeyhate9/jingzhang-ai-double-helix/geometry/land_use.geojson",
        "submissions/Jackeyhate9/jingzhang-ai-double-helix/geometry/phasing.geojson",
        "submissions/Jackeyhate9/jingzhang-ai-double-helix/geometry/public_space.geojson",
        "submissions/Jackeyhate9/jingzhang-ai-double-helix/geometry/roads.geojson",
        "submissions/Jackeyhate9/jingzhang-ai-double-helix/geometry/site_boundary.geojson",
        "submissions/Jackeyhate9/jingzhang-ai-double-helix/manifest.json",
        "submissions/Jackeyhate9/jingzhang-ai-double-helix/metrics.json",
        "submissions/Jackeyhate9/jingzhang-ai-double-helix/proposal.en.md",
        "submissions/Jackeyhate9/jingzhang-ai-double-helix/proposal.md",
        "submissions/Jackeyhate9/jingzhang-ai-double-helix/report/copyright_statement.md",
        "submissions/Jackeyhate9/jingzhang-ai-double-helix/report/narrative.md",
        "submissions/Jackeyhate9/jingzhang-ai-double-helix/report/proposal.en.html",
        "submissions/Jackeyhate9/jingzhang-ai-double-helix/report/proposal.html",
        "submissions/Jackeyhate9/jingzhang-ai-double-helix/self_check.json",
        "submissions/Jackeyhate9/jingzhang-ai-double-helix/sources.json",
        "submissions/Jackeyhate9/jingzhang-ai-double-helix/standard_matrix.json",
        "submissions/Jackeyhate9/jingzhang-ai-double-helix/visual/index.en.html",
        "submissions/Jackeyhate9/jingzhang-ai-double-helix/visual/index.html"
      ],
      "ai_package_stages": {
        "submissions/Jackeyhate9/jingzhang-ai-double-helix": "formal"
      },
      "total_bytes": 2357878,
      "maintainer_bypass": false
    },
    "stderr": ""
  },
  "spatial_review": {
    "returncode": 0,
    "ok": true,
    "stdout": {
      "ok": true,
      "stage": "formal",
      "issues": [
        {
          "check_id": "KEY_AREA_PROVISIONAL",
          "severity": "minor",
          "target_file": "geometry/key_areas.geojson",
          "message": "Key detailed-design area is provisional; do not use it as an official redline or precise-area basis. Content scoring remains eligible.",
          "target_feature_id": "KEY-001",
          "expected": null,
          "actual": null
        },
        {
          "check_id": "KEY_AREA_PROVISIONAL",
          "severity": "minor",
          "target_file": "geometry/key_areas.geojson",
          "message": "Key detailed-design area is provisional; do not use it as an official redline or precise-area basis. Content scoring remains eligible.",
          "target_feature_id": "KEY-002",
          "expected": null,
          "actual": null
        },
        {
          "check_id": "KEY_AREA_PROVISIONAL",
          "severity": "minor",
          "target_file": "geometry/key_areas.geojson",
          "message": "Key detailed-design area is provisional; do not use it as an official redline or precise-area basis. Content scoring remains eligible.",
          "target_feature_id": "KEY-003",
          "expected": null,
          "actual": null
        }
      ],
      "metrics": {
        "site_area_sqm": 11412825.386,
        "green_space_area_sqm": 1877410.893,
        "public_space_area_sqm": 47802.265,
        "building_footprint_area_sqm": 159339.897,
        "green_ratio": 0.1645,
        "public_space_ratio": 0.004188
      }
    },
    "stderr": ""
  },
  "visual_review": {
    "returncode": 0,
    "ok": true,
    "stdout": {
      "ok": true,
      "issues": [],
      "metrics_seen": {
        "site_area_sqm": 11412825.386,
        "green_ratio": 0.1645,
        "public_space_ratio": 0.004188
      }
    },
    "stderr": ""
  },
  "professional_review": {
    "returncode": 0,
    "ok": true,
    "stdout": {
      "ok": true,
      "issues": [],
      "summary": {
        "standard_matrix_items": 6,
        "design_depth_items": 15,
        "known_metric_refs_required": 8,
        "proposal_format_version": "2",
        "evidence_contract": "section-anchors-plus-structured-audit",
        "proposal_reference_counts": {
          "source": 5,
          "standard": 4,
          "depth": 15,
          "data": 11,
          "metric": 6
        }
      }
    },
    "stderr": ""
  },
  "spatial_issue_ids": [
    "KEY_AREA_PROVISIONAL",
    "KEY_AREA_PROVISIONAL",
    "KEY_AREA_PROVISIONAL"
  ],
  "visual_issue_ids": [],
  "professional_issue_ids": [],
  "missing_review_dependencies": [],
  "can_enter_formal_review": true,
  "package_type": "professional_design_package",
  "review_status": "formal-review-ready",
  "next_actions": [],
  "schema_version": "0.1.0",
  "checks": [
    {
      "check_id": "DETERMINISTIC_VALIDATION",
      "result": "pass",
      "severity": "blocking",
      "target": "validate_local_submission.py",
      "message": "deterministic_validation: PASS"
    },
    {
      "check_id": "SPATIAL_REVIEW",
      "result": "pass",
      "severity": "blocking",
      "target": "spatial_review.py",
      "message": "spatial_review: PASS"
    },
    {
      "check_id": "VISUAL_PACKAGING",
      "result": "pass",
      "severity": "blocking",
      "target": "visual_review.py",
      "message": "visual_review: PASS"
    },
    {
      "check_id": "PROFESSIONAL_EVIDENCE",
      "result": "pass",
      "severity": "blocking",
      "target": "professional_review.py",
      "message": "professional_review: PASS"
    }
  ]
}
