{
  "ok": true,
  "submission_dir": "submissions/lcly2462525/jingzhang-slow-variables",
  "pr_author": "lcly2462525",
  "stage": "formal",
  "deterministic_validation": {
    "returncode": 0,
    "ok": true,
    "stdout": {
      "ok": true,
      "errors": [],
      "warnings": [
        "submissions/lcly2462525/jingzhang-slow-variables/geometry/site_boundary.geojson: uses provisional boundary; do not treat it as an official redline or precise-area basis. Organizer data gaps do not block content scoring; recalculate when official geometry is supplied"
      ],
      "proposal_files": [
        "submissions/lcly2462525/jingzhang-slow-variables/proposal.md"
      ],
      "changelog_files": [
        "submissions/lcly2462525/jingzhang-slow-variables/changelog.md"
      ],
      "changed_files": [
        "submissions/lcly2462525/jingzhang-slow-variables/agent.json",
        "submissions/lcly2462525/jingzhang-slow-variables/assets/figures/key-areas.en.png",
        "submissions/lcly2462525/jingzhang-slow-variables/assets/figures/key-areas.png",
        "submissions/lcly2462525/jingzhang-slow-variables/assets/figures/land-use-structure.en.png",
        "submissions/lcly2462525/jingzhang-slow-variables/assets/figures/land-use-structure.png",
        "submissions/lcly2462525/jingzhang-slow-variables/assets/figures/metrics-evidence.en.png",
        "submissions/lcly2462525/jingzhang-slow-variables/assets/figures/metrics-evidence.png",
        "submissions/lcly2462525/jingzhang-slow-variables/assets/figures/mobility-bluegreen.en.png",
        "submissions/lcly2462525/jingzhang-slow-variables/assets/figures/mobility-bluegreen.png",
        "submissions/lcly2462525/jingzhang-slow-variables/assets/figures/site-overview.en.png",
        "submissions/lcly2462525/jingzhang-slow-variables/assets/figures/site-overview.png",
        "submissions/lcly2462525/jingzhang-slow-variables/assets/figures/slow-variable-section.en.png",
        "submissions/lcly2462525/jingzhang-slow-variables/assets/figures/slow-variable-section.png",
        "submissions/lcly2462525/jingzhang-slow-variables/assumptions.json",
        "submissions/lcly2462525/jingzhang-slow-variables/changelog.md",
        "submissions/lcly2462525/jingzhang-slow-variables/compliance_matrix.json",
        "submissions/lcly2462525/jingzhang-slow-variables/design_depth_matrix.json",
        "submissions/lcly2462525/jingzhang-slow-variables/drawings/a0-boards.en.pdf",
        "submissions/lcly2462525/jingzhang-slow-variables/drawings/a0-boards.pdf",
        "submissions/lcly2462525/jingzhang-slow-variables/drawings/a3-booklet.en.pdf",
        "submissions/lcly2462525/jingzhang-slow-variables/drawings/a3-booklet.pdf",
        "submissions/lcly2462525/jingzhang-slow-variables/geometry/buildings.geojson",
        "submissions/lcly2462525/jingzhang-slow-variables/geometry/constraints.geojson",
        "submissions/lcly2462525/jingzhang-slow-variables/geometry/green_space.geojson",
        "submissions/lcly2462525/jingzhang-slow-variables/geometry/key_areas.geojson",
        "submissions/lcly2462525/jingzhang-slow-variables/geometry/land_use.geojson",
        "submissions/lcly2462525/jingzhang-slow-variables/geometry/phasing.geojson",
        "submissions/lcly2462525/jingzhang-slow-variables/geometry/public_space.geojson",
        "submissions/lcly2462525/jingzhang-slow-variables/geometry/roads.geojson",
        "submissions/lcly2462525/jingzhang-slow-variables/geometry/site_boundary.geojson",
        "submissions/lcly2462525/jingzhang-slow-variables/manifest.json",
        "submissions/lcly2462525/jingzhang-slow-variables/metrics.json",
        "submissions/lcly2462525/jingzhang-slow-variables/proposal.en.md",
        "submissions/lcly2462525/jingzhang-slow-variables/proposal.md",
        "submissions/lcly2462525/jingzhang-slow-variables/report/copyright_statement.md",
        "submissions/lcly2462525/jingzhang-slow-variables/report/narrative.md",
        "submissions/lcly2462525/jingzhang-slow-variables/report/proposal.en.html",
        "submissions/lcly2462525/jingzhang-slow-variables/report/proposal.html",
        "submissions/lcly2462525/jingzhang-slow-variables/self_check.json",
        "submissions/lcly2462525/jingzhang-slow-variables/sources.json",
        "submissions/lcly2462525/jingzhang-slow-variables/standard_matrix.json",
        "submissions/lcly2462525/jingzhang-slow-variables/visual/index.en.html",
        "submissions/lcly2462525/jingzhang-slow-variables/visual/index.html"
      ],
      "ai_package_stages": {
        "submissions/lcly2462525/jingzhang-slow-variables": "formal"
      },
      "total_bytes": 13751301,
      "maintainer_bypass": false
    },
    "stderr": ""
  },
  "spatial_review": {
    "returncode": 0,
    "ok": true,
    "stdout": {
      "ok": true,
      "stage": "formal",
      "issues": [
        {
          "check_id": "KEY_AREA_PROVISIONAL",
          "severity": "minor",
          "target_file": "geometry/key_areas.geojson",
          "message": "Key detailed-design area is provisional; do not use it as an official redline or precise-area basis. Content scoring remains eligible.",
          "target_feature_id": "PROV-KEY-001",
          "expected": null,
          "actual": null
        },
        {
          "check_id": "KEY_AREA_PROVISIONAL",
          "severity": "minor",
          "target_file": "geometry/key_areas.geojson",
          "message": "Key detailed-design area is provisional; do not use it as an official redline or precise-area basis. Content scoring remains eligible.",
          "target_feature_id": "PROV-KEY-002",
          "expected": null,
          "actual": null
        },
        {
          "check_id": "KEY_AREA_PROVISIONAL",
          "severity": "minor",
          "target_file": "geometry/key_areas.geojson",
          "message": "Key detailed-design area is provisional; do not use it as an official redline or precise-area basis. Content scoring remains eligible.",
          "target_feature_id": "PROV-KEY-003",
          "expected": null,
          "actual": null
        }
      ],
      "metrics": {
        "site_area_sqm": 11412825.386,
        "green_space_area_sqm": 1408600.768,
        "public_space_area_sqm": 843905.098,
        "building_footprint_area_sqm": 310807.184,
        "green_ratio": 0.123423,
        "public_space_ratio": 0.073944
      }
    },
    "stderr": ""
  },
  "visual_review": {
    "returncode": 0,
    "ok": true,
    "stdout": {
      "ok": true,
      "issues": [],
      "metrics_seen": {
        "site_area_sqm": 11412825.386,
        "building_footprint_area_sqm": 310807.184,
        "green_ratio": 0.123423,
        "public_space_ratio": 0.073944,
        "scenario_card_count": 12.0,
        "industry_test_count": 3.0,
        "key_area_count": 3.0,
        "exit_gate_count": 4.0
      }
    },
    "stderr": ""
  },
  "professional_review": {
    "returncode": 0,
    "ok": true,
    "stdout": {
      "ok": true,
      "issues": [],
      "summary": {
        "standard_matrix_items": 6,
        "design_depth_items": 15,
        "known_metric_refs_required": 9,
        "proposal_format_version": "2",
        "evidence_contract": "section-anchors-plus-structured-audit",
        "proposal_reference_counts": {
          "source": 19,
          "standard": 8,
          "depth": 15,
          "data": 9,
          "metric": 5
        }
      }
    },
    "stderr": ""
  },
  "spatial_issue_ids": [
    "KEY_AREA_PROVISIONAL",
    "KEY_AREA_PROVISIONAL",
    "KEY_AREA_PROVISIONAL"
  ],
  "visual_issue_ids": [],
  "professional_issue_ids": [],
  "missing_review_dependencies": [],
  "can_enter_formal_review": true,
  "package_type": "professional_design_package",
  "review_status": "formal-review-ready",
  "next_actions": [],
  "schema_version": "0.1.0",
  "checks": [
    {
      "check_id": "DETERMINISTIC_VALIDATION",
      "result": "pass",
      "severity": "blocking",
      "target": "validate_local_submission.py",
      "message": "deterministic_validation: PASS"
    },
    {
      "check_id": "SPATIAL_REVIEW",
      "result": "pass",
      "severity": "blocking",
      "target": "spatial_review.py",
      "message": "spatial_review: PASS"
    },
    {
      "check_id": "VISUAL_PACKAGING",
      "result": "pass",
      "severity": "blocking",
      "target": "visual_review.py",
      "message": "visual_review: PASS"
    },
    {
      "check_id": "PROFESSIONAL_EVIDENCE",
      "result": "pass",
      "severity": "blocking",
      "target": "professional_review.py",
      "message": "professional_review: PASS"
    }
  ]
}
