{
  "ok": true,
  "submission_dir": "submissions/563323549-boop/jingzhang-flow-model",
  "pr_author": "563323549-boop",
  "stage": "formal",
  "deterministic_validation": {
    "returncode": 0,
    "ok": true,
    "stdout": {
      "ok": true,
      "errors": [],
      "warnings": [
        "submissions/563323549-boop/jingzhang-flow-model/proposal.md: 可能涉及非公开或敏感资料; maintainer review required",
        "submissions/563323549-boop/jingzhang-flow-model/geometry/site_boundary.geojson: uses provisional boundary; do not treat it as an official redline or precise-area basis. Organizer data gaps do not block content scoring; recalculate when official geometry is supplied"
      ],
      "proposal_files": [
        "submissions/563323549-boop/jingzhang-flow-model/proposal.md"
      ],
      "changelog_files": [],
      "changed_files": [
        "submissions/563323549-boop/jingzhang-flow-model/agent.json",
        "submissions/563323549-boop/jingzhang-flow-model/assets/figures/key-areas.en.png",
        "submissions/563323549-boop/jingzhang-flow-model/assets/figures/key-areas.png",
        "submissions/563323549-boop/jingzhang-flow-model/assets/figures/land-use-structure.en.png",
        "submissions/563323549-boop/jingzhang-flow-model/assets/figures/land-use-structure.png",
        "submissions/563323549-boop/jingzhang-flow-model/assets/figures/metrics-evidence.en.png",
        "submissions/563323549-boop/jingzhang-flow-model/assets/figures/metrics-evidence.png",
        "submissions/563323549-boop/jingzhang-flow-model/assets/figures/mobility-bluegreen.en.png",
        "submissions/563323549-boop/jingzhang-flow-model/assets/figures/mobility-bluegreen.png",
        "submissions/563323549-boop/jingzhang-flow-model/assets/figures/site-overview.en.png",
        "submissions/563323549-boop/jingzhang-flow-model/assets/figures/site-overview.png",
        "submissions/563323549-boop/jingzhang-flow-model/assumptions.json",
        "submissions/563323549-boop/jingzhang-flow-model/compliance_matrix.json",
        "submissions/563323549-boop/jingzhang-flow-model/design_depth_matrix.json",
        "submissions/563323549-boop/jingzhang-flow-model/drawings/a0-boards.en.pdf",
        "submissions/563323549-boop/jingzhang-flow-model/drawings/a0-boards.pdf",
        "submissions/563323549-boop/jingzhang-flow-model/drawings/a3-booklet.en.pdf",
        "submissions/563323549-boop/jingzhang-flow-model/drawings/a3-booklet.pdf",
        "submissions/563323549-boop/jingzhang-flow-model/geometry/buildings.geojson",
        "submissions/563323549-boop/jingzhang-flow-model/geometry/constraints.geojson",
        "submissions/563323549-boop/jingzhang-flow-model/geometry/green_space.geojson",
        "submissions/563323549-boop/jingzhang-flow-model/geometry/key_areas.geojson",
        "submissions/563323549-boop/jingzhang-flow-model/geometry/land_use.geojson",
        "submissions/563323549-boop/jingzhang-flow-model/geometry/phasing.geojson",
        "submissions/563323549-boop/jingzhang-flow-model/geometry/public_space.geojson",
        "submissions/563323549-boop/jingzhang-flow-model/geometry/roads.geojson",
        "submissions/563323549-boop/jingzhang-flow-model/geometry/site_boundary.geojson",
        "submissions/563323549-boop/jingzhang-flow-model/manifest.json",
        "submissions/563323549-boop/jingzhang-flow-model/metrics.json",
        "submissions/563323549-boop/jingzhang-flow-model/proposal.en.md",
        "submissions/563323549-boop/jingzhang-flow-model/proposal.md",
        "submissions/563323549-boop/jingzhang-flow-model/report/copyright_statement.md",
        "submissions/563323549-boop/jingzhang-flow-model/report/narrative.md",
        "submissions/563323549-boop/jingzhang-flow-model/report/proposal.en.html",
        "submissions/563323549-boop/jingzhang-flow-model/report/proposal.html",
        "submissions/563323549-boop/jingzhang-flow-model/self_check.json",
        "submissions/563323549-boop/jingzhang-flow-model/sources.json",
        "submissions/563323549-boop/jingzhang-flow-model/standard_matrix.json",
        "submissions/563323549-boop/jingzhang-flow-model/visual/index.en.html",
        "submissions/563323549-boop/jingzhang-flow-model/visual/index.html"
      ],
      "ai_package_stages": {
        "submissions/563323549-boop/jingzhang-flow-model": "formal"
      },
      "total_bytes": 5317556,
      "maintainer_bypass": false
    },
    "stderr": ""
  },
  "spatial_review": {
    "returncode": 0,
    "ok": true,
    "stdout": {
      "ok": true,
      "stage": "formal",
      "issues": [
        {
          "check_id": "KEY_AREA_PROVISIONAL",
          "severity": "minor",
          "target_file": "geometry/key_areas.geojson",
          "message": "Key detailed-design area is provisional; do not use it as an official redline or precise-area basis. Content scoring remains eligible.",
          "target_feature_id": "KEY-001",
          "expected": null,
          "actual": null
        },
        {
          "check_id": "KEY_AREA_PROVISIONAL",
          "severity": "minor",
          "target_file": "geometry/key_areas.geojson",
          "message": "Key detailed-design area is provisional; do not use it as an official redline or precise-area basis. Content scoring remains eligible.",
          "target_feature_id": "KEY-002",
          "expected": null,
          "actual": null
        },
        {
          "check_id": "KEY_AREA_PROVISIONAL",
          "severity": "minor",
          "target_file": "geometry/key_areas.geojson",
          "message": "Key detailed-design area is provisional; do not use it as an official redline or precise-area basis. Content scoring remains eligible.",
          "target_feature_id": "KEY-003",
          "expected": null,
          "actual": null
        }
      ],
      "metrics": {
        "site_area_sqm": 11412825.386,
        "green_space_area_sqm": 2047359.147,
        "public_space_area_sqm": 248579.252,
        "building_footprint_area_sqm": 10754.876,
        "green_ratio": 0.179391,
        "public_space_ratio": 0.021781
      }
    },
    "stderr": ""
  },
  "visual_review": {
    "returncode": 0,
    "ok": true,
    "stdout": {
      "ok": true,
      "issues": [],
      "metrics_seen": {
        "site_area_sqm": 11412825.4,
        "green_ratio": 0.1794,
        "public_space_ratio": 0.0218
      }
    },
    "stderr": ""
  },
  "professional_review": {
    "returncode": 0,
    "ok": true,
    "stdout": {
      "ok": true,
      "issues": [],
      "summary": {
        "standard_matrix_items": 6,
        "design_depth_items": 15,
        "known_metric_refs_required": 6,
        "proposal_format_version": "2",
        "evidence_contract": "section-anchors-plus-structured-audit",
        "proposal_reference_counts": {
          "source": 4,
          "standard": 2,
          "depth": 2,
          "data": 18,
          "metric": 3
        }
      }
    },
    "stderr": ""
  },
  "spatial_issue_ids": [
    "KEY_AREA_PROVISIONAL",
    "KEY_AREA_PROVISIONAL",
    "KEY_AREA_PROVISIONAL"
  ],
  "visual_issue_ids": [],
  "professional_issue_ids": [],
  "missing_review_dependencies": [],
  "can_enter_formal_review": true,
  "package_type": "professional_design_package",
  "review_status": "formal-review-ready",
  "next_actions": [],
  "schema_version": "0.1.0",
  "checks": [
    {
      "check_id": "DETERMINISTIC_VALIDATION",
      "result": "pass",
      "severity": "blocking",
      "target": "validate_local_submission.py",
      "message": "deterministic_validation: PASS"
    },
    {
      "check_id": "SPATIAL_REVIEW",
      "result": "pass",
      "severity": "blocking",
      "target": "spatial_review.py",
      "message": "spatial_review: PASS"
    },
    {
      "check_id": "VISUAL_PACKAGING",
      "result": "pass",
      "severity": "blocking",
      "target": "visual_review.py",
      "message": "visual_review: PASS"
    },
    {
      "check_id": "PROFESSIONAL_EVIDENCE",
      "result": "pass",
      "severity": "blocking",
      "target": "professional_review.py",
      "message": "professional_review: PASS"
    }
  ]
}
