{
  "ok": true,
  "submission_dir": "submissions/Michael-Han0608/jingzhang-ai-green-spine",
  "pr_author": "Michael-Han0608",
  "stage": "formal",
  "deterministic_validation": {
    "returncode": 0,
    "ok": true,
    "stdout": {
      "ok": true,
      "errors": [],
      "warnings": [
        "submissions/Michael-Han0608/jingzhang-ai-green-spine/geometry/site_boundary.geojson: uses provisional boundary; do not treat it as an official redline or precise-area basis. Organizer data gaps do not block content scoring; recalculate when official geometry is supplied"
      ],
      "proposal_files": [
        "submissions/Michael-Han0608/jingzhang-ai-green-spine/proposal.md"
      ],
      "changelog_files": [
        "submissions/Michael-Han0608/jingzhang-ai-green-spine/changelog.md"
      ],
      "changed_files": [
        "submissions/Michael-Han0608/jingzhang-ai-green-spine/agent.json",
        "submissions/Michael-Han0608/jingzhang-ai-green-spine/assets/figures/key-areas.en.png",
        "submissions/Michael-Han0608/jingzhang-ai-green-spine/assets/figures/key-areas.png",
        "submissions/Michael-Han0608/jingzhang-ai-green-spine/assets/figures/land-use-structure.en.png",
        "submissions/Michael-Han0608/jingzhang-ai-green-spine/assets/figures/land-use-structure.png",
        "submissions/Michael-Han0608/jingzhang-ai-green-spine/assets/figures/metrics-evidence.en.png",
        "submissions/Michael-Han0608/jingzhang-ai-green-spine/assets/figures/metrics-evidence.png",
        "submissions/Michael-Han0608/jingzhang-ai-green-spine/assets/figures/mobility-bluegreen.en.png",
        "submissions/Michael-Han0608/jingzhang-ai-green-spine/assets/figures/mobility-bluegreen.png",
        "submissions/Michael-Han0608/jingzhang-ai-green-spine/assets/figures/site-overview.en.png",
        "submissions/Michael-Han0608/jingzhang-ai-green-spine/assets/figures/site-overview.png",
        "submissions/Michael-Han0608/jingzhang-ai-green-spine/assumptions.json",
        "submissions/Michael-Han0608/jingzhang-ai-green-spine/changelog.md",
        "submissions/Michael-Han0608/jingzhang-ai-green-spine/compliance_matrix.json",
        "submissions/Michael-Han0608/jingzhang-ai-green-spine/design_depth_matrix.json",
        "submissions/Michael-Han0608/jingzhang-ai-green-spine/drawings/a0-boards.en.pdf",
        "submissions/Michael-Han0608/jingzhang-ai-green-spine/drawings/a0-boards.pdf",
        "submissions/Michael-Han0608/jingzhang-ai-green-spine/drawings/a3-booklet.en.pdf",
        "submissions/Michael-Han0608/jingzhang-ai-green-spine/drawings/a3-booklet.pdf",
        "submissions/Michael-Han0608/jingzhang-ai-green-spine/geometry/buildings.geojson",
        "submissions/Michael-Han0608/jingzhang-ai-green-spine/geometry/constraints.geojson",
        "submissions/Michael-Han0608/jingzhang-ai-green-spine/geometry/green_space.geojson",
        "submissions/Michael-Han0608/jingzhang-ai-green-spine/geometry/key_areas.geojson",
        "submissions/Michael-Han0608/jingzhang-ai-green-spine/geometry/land_use.geojson",
        "submissions/Michael-Han0608/jingzhang-ai-green-spine/geometry/phasing.geojson",
        "submissions/Michael-Han0608/jingzhang-ai-green-spine/geometry/public_space.geojson",
        "submissions/Michael-Han0608/jingzhang-ai-green-spine/geometry/roads.geojson",
        "submissions/Michael-Han0608/jingzhang-ai-green-spine/geometry/site_boundary.geojson",
        "submissions/Michael-Han0608/jingzhang-ai-green-spine/manifest.json",
        "submissions/Michael-Han0608/jingzhang-ai-green-spine/metrics.json",
        "submissions/Michael-Han0608/jingzhang-ai-green-spine/proposal.en.md",
        "submissions/Michael-Han0608/jingzhang-ai-green-spine/proposal.md",
        "submissions/Michael-Han0608/jingzhang-ai-green-spine/report/copyright_statement.md",
        "submissions/Michael-Han0608/jingzhang-ai-green-spine/report/narrative.md",
        "submissions/Michael-Han0608/jingzhang-ai-green-spine/report/proposal.en.html",
        "submissions/Michael-Han0608/jingzhang-ai-green-spine/report/proposal.html",
        "submissions/Michael-Han0608/jingzhang-ai-green-spine/self_check.json",
        "submissions/Michael-Han0608/jingzhang-ai-green-spine/sources.json",
        "submissions/Michael-Han0608/jingzhang-ai-green-spine/standard_matrix.json",
        "submissions/Michael-Han0608/jingzhang-ai-green-spine/visual/index.en.html",
        "submissions/Michael-Han0608/jingzhang-ai-green-spine/visual/index.html"
      ],
      "ai_package_stages": {
        "submissions/Michael-Han0608/jingzhang-ai-green-spine": "formal"
      },
      "total_bytes": 2959464,
      "maintainer_bypass": false
    },
    "stderr": ""
  },
  "spatial_review": {
    "returncode": 0,
    "ok": true,
    "stdout": {
      "ok": true,
      "stage": "formal",
      "issues": [
        {
          "check_id": "KEY_AREA_PROVISIONAL",
          "severity": "minor",
          "target_file": "geometry/key_areas.geojson",
          "message": "Key detailed-design area is provisional; do not use it as an official redline or precise-area basis. Content scoring remains eligible.",
          "target_feature_id": "PROV-KEY-001",
          "expected": null,
          "actual": null
        },
        {
          "check_id": "KEY_AREA_PROVISIONAL",
          "severity": "minor",
          "target_file": "geometry/key_areas.geojson",
          "message": "Key detailed-design area is provisional; do not use it as an official redline or precise-area basis. Content scoring remains eligible.",
          "target_feature_id": "PROV-KEY-002",
          "expected": null,
          "actual": null
        },
        {
          "check_id": "KEY_AREA_PROVISIONAL",
          "severity": "minor",
          "target_file": "geometry/key_areas.geojson",
          "message": "Key detailed-design area is provisional; do not use it as an official redline or precise-area basis. Content scoring remains eligible.",
          "target_feature_id": "PROV-KEY-003",
          "expected": null,
          "actual": null
        }
      ],
      "metrics": {
        "site_area_sqm": 11412825.386,
        "green_space_area_sqm": 2820997.504,
        "public_space_area_sqm": 2887591.531,
        "building_footprint_area_sqm": 889125.927,
        "green_ratio": 0.247178,
        "public_space_ratio": 0.253013
      }
    },
    "stderr": ""
  },
  "visual_review": {
    "returncode": 0,
    "ok": true,
    "stdout": {
      "ok": true,
      "issues": [],
      "metrics_seen": {
        "site_area_sqm": 11412825.4,
        "green_ratio": 0.247178,
        "public_space_ratio": 0.253013,
        "building_density": 0.077906,
        "road_ratio": 0.164458,
        "key_area_count": 3.0,
        "land_use_1401_area_sqm": 2500471.8,
        "land_use_0802_area_sqm": 2227249.9,
        "land_use_1207_area_sqm": 1876934.2,
        "land_use_05_area_sqm": 1203488.0,
        "land_use_0701_area_sqm": 1095856.5,
        "land_use_0804_area_sqm": 805907.6,
        "land_use_1403_area_sqm": 387119.7,
        "land_use_0803_area_sqm": 189679.5
      }
    },
    "stderr": ""
  },
  "professional_review": {
    "returncode": 0,
    "ok": true,
    "stdout": {
      "ok": true,
      "issues": [],
      "summary": {
        "standard_matrix_items": 6,
        "design_depth_items": 15,
        "known_metric_refs_required": 30,
        "proposal_format_version": "2",
        "evidence_contract": "section-anchors-plus-structured-audit",
        "proposal_reference_counts": {
          "source": 12,
          "standard": 7,
          "depth": 15,
          "data": 20,
          "metric": 18
        }
      }
    },
    "stderr": ""
  },
  "spatial_issue_ids": [
    "KEY_AREA_PROVISIONAL",
    "KEY_AREA_PROVISIONAL",
    "KEY_AREA_PROVISIONAL"
  ],
  "visual_issue_ids": [],
  "professional_issue_ids": [],
  "missing_review_dependencies": [],
  "can_enter_formal_review": true,
  "package_type": "professional_design_package",
  "review_status": "formal-review-ready",
  "next_actions": [],
  "schema_version": "0.1.0",
  "checks": [
    {
      "check_id": "DETERMINISTIC_VALIDATION",
      "result": "pass",
      "severity": "blocking",
      "target": "validate_local_submission.py",
      "message": "deterministic_validation: PASS"
    },
    {
      "check_id": "SPATIAL_REVIEW",
      "result": "pass",
      "severity": "blocking",
      "target": "spatial_review.py",
      "message": "spatial_review: PASS"
    },
    {
      "check_id": "VISUAL_PACKAGING",
      "result": "pass",
      "severity": "blocking",
      "target": "visual_review.py",
      "message": "visual_review: PASS"
    },
    {
      "check_id": "PROFESSIONAL_EVIDENCE",
      "result": "pass",
      "severity": "blocking",
      "target": "professional_review.py",
      "message": "professional_review: PASS"
    }
  ]
}
