{
  "ok": true,
  "submission_dir": "submissions\\JohnXu22786\\district-carbon-accounting",
  "pr_author": "JohnXu22786",
  "stage": "formal",
  "deterministic_validation": {
    "returncode": 0,
    "ok": true,
    "stdout": {
      "ok": true,
      "errors": [],
      "warnings": [
        "submissions/JohnXu22786/district-carbon-accounting/geometry/site_boundary.geojson: uses provisional boundary; do not treat it as an official redline or precise-area basis. Organizer data gaps do not block content scoring; recalculate when official geometry is supplied"
      ],
      "proposal_files": [
        "submissions/JohnXu22786/district-carbon-accounting/proposal.md"
      ],
      "changelog_files": [
        "submissions/JohnXu22786/district-carbon-accounting/changelog.md"
      ],
      "changed_files": [
        "submissions/JohnXu22786/district-carbon-accounting/agent.json",
        "submissions/JohnXu22786/district-carbon-accounting/assets/figures/ecosystem-atlas.en.png",
        "submissions/JohnXu22786/district-carbon-accounting/assets/figures/ecosystem-atlas.png",
        "submissions/JohnXu22786/district-carbon-accounting/assets/figures/key-areas.en.png",
        "submissions/JohnXu22786/district-carbon-accounting/assets/figures/key-areas.png",
        "submissions/JohnXu22786/district-carbon-accounting/assets/figures/land-use-structure.en.png",
        "submissions/JohnXu22786/district-carbon-accounting/assets/figures/land-use-structure.png",
        "submissions/JohnXu22786/district-carbon-accounting/assets/figures/logo-brand.en.png",
        "submissions/JohnXu22786/district-carbon-accounting/assets/figures/logo-brand.png",
        "submissions/JohnXu22786/district-carbon-accounting/assets/figures/metrics-evidence.en.png",
        "submissions/JohnXu22786/district-carbon-accounting/assets/figures/metrics-evidence.png",
        "submissions/JohnXu22786/district-carbon-accounting/assets/figures/mobility-bluegreen.en.png",
        "submissions/JohnXu22786/district-carbon-accounting/assets/figures/mobility-bluegreen.png",
        "submissions/JohnXu22786/district-carbon-accounting/assets/figures/site-overview.en.png",
        "submissions/JohnXu22786/district-carbon-accounting/assets/figures/site-overview.png",
        "submissions/JohnXu22786/district-carbon-accounting/assumptions.json",
        "submissions/JohnXu22786/district-carbon-accounting/changelog.md",
        "submissions/JohnXu22786/district-carbon-accounting/compliance_matrix.json",
        "submissions/JohnXu22786/district-carbon-accounting/design_depth_matrix.json",
        "submissions/JohnXu22786/district-carbon-accounting/drawings/a0-boards.en.pdf",
        "submissions/JohnXu22786/district-carbon-accounting/drawings/a0-boards.pdf",
        "submissions/JohnXu22786/district-carbon-accounting/drawings/a3-booklet.en.pdf",
        "submissions/JohnXu22786/district-carbon-accounting/drawings/a3-booklet.pdf",
        "submissions/JohnXu22786/district-carbon-accounting/geometry/buildings.geojson",
        "submissions/JohnXu22786/district-carbon-accounting/geometry/constraints.geojson",
        "submissions/JohnXu22786/district-carbon-accounting/geometry/green_space.geojson",
        "submissions/JohnXu22786/district-carbon-accounting/geometry/key_areas.geojson",
        "submissions/JohnXu22786/district-carbon-accounting/geometry/land_use.geojson",
        "submissions/JohnXu22786/district-carbon-accounting/geometry/phasing.geojson",
        "submissions/JohnXu22786/district-carbon-accounting/geometry/public_space.geojson",
        "submissions/JohnXu22786/district-carbon-accounting/geometry/roads.geojson",
        "submissions/JohnXu22786/district-carbon-accounting/geometry/site_boundary.geojson",
        "submissions/JohnXu22786/district-carbon-accounting/manifest.json",
        "submissions/JohnXu22786/district-carbon-accounting/metrics.json",
        "submissions/JohnXu22786/district-carbon-accounting/proposal.en.md",
        "submissions/JohnXu22786/district-carbon-accounting/proposal.md",
        "submissions/JohnXu22786/district-carbon-accounting/report/copyright_statement.md",
        "submissions/JohnXu22786/district-carbon-accounting/report/narrative.md",
        "submissions/JohnXu22786/district-carbon-accounting/report/proposal.en.html",
        "submissions/JohnXu22786/district-carbon-accounting/report/proposal.html",
        "submissions/JohnXu22786/district-carbon-accounting/risk.json",
        "submissions/JohnXu22786/district-carbon-accounting/self_check.json",
        "submissions/JohnXu22786/district-carbon-accounting/sources.json",
        "submissions/JohnXu22786/district-carbon-accounting/standard_matrix.json",
        "submissions/JohnXu22786/district-carbon-accounting/visual/index.en.html",
        "submissions/JohnXu22786/district-carbon-accounting/visual/index.html"
      ],
      "ai_package_stages": {
        "submissions/JohnXu22786/district-carbon-accounting": "formal"
      },
      "total_bytes": 6710307,
      "maintainer_bypass": false
    },
    "stderr": ""
  },
  "spatial_review": {
    "returncode": 0,
    "ok": true,
    "stdout": {
      "ok": true,
      "stage": "formal",
      "issues": [
        {
          "check_id": "KEY_AREA_PROVISIONAL",
          "severity": "minor",
          "target_file": "geometry/key_areas.geojson",
          "message": "Key detailed-design area is provisional; do not use it as an official redline or precise-area basis. Content scoring remains eligible.",
          "target_feature_id": "KEY-ZHON",
          "expected": null,
          "actual": null
        },
        {
          "check_id": "KEY_AREA_PROVISIONAL",
          "severity": "minor",
          "target_file": "geometry/key_areas.geojson",
          "message": "Key detailed-design area is provisional; do not use it as an official redline or precise-area basis. Content scoring remains eligible.",
          "target_feature_id": "KEY-BEIJ",
          "expected": null,
          "actual": null
        },
        {
          "check_id": "KEY_AREA_PROVISIONAL",
          "severity": "minor",
          "target_file": "geometry/key_areas.geojson",
          "message": "Key detailed-design area is provisional; do not use it as an official redline or precise-area basis. Content scoring remains eligible.",
          "target_feature_id": "KEY-DAZH",
          "expected": null,
          "actual": null
        }
      ],
      "metrics": {
        "site_area_sqm": 11412825.386,
        "green_space_area_sqm": 1255908.493,
        "public_space_area_sqm": 36150.0,
        "building_footprint_area_sqm": 111600.0,
        "green_ratio": 0.110044,
        "public_space_ratio": 0.003167
      }
    },
    "stderr": ""
  },
  "visual_review": {
    "returncode": 0,
    "ok": true,
    "stdout": {
      "ok": true,
      "issues": [],
      "metrics_seen": {
        "site_area_sqm": 11412825.386,
        "green_ratio": 0.110044,
        "public_space_ratio": 0.003167
      }
    },
    "stderr": ""
  },
  "professional_review": {
    "returncode": 0,
    "ok": true,
    "stdout": {
      "ok": true,
      "issues": [],
      "summary": {
        "standard_matrix_items": 5,
        "design_depth_items": 15,
        "known_metric_refs_required": 19,
        "proposal_format_version": "2",
        "evidence_contract": "section-anchors-plus-structured-audit",
        "proposal_reference_counts": {
          "source": 5,
          "standard": 3,
          "depth": 5,
          "data": 1,
          "metric": 8
        }
      }
    },
    "stderr": ""
  },
  "spatial_issue_ids": [
    "KEY_AREA_PROVISIONAL",
    "KEY_AREA_PROVISIONAL",
    "KEY_AREA_PROVISIONAL"
  ],
  "visual_issue_ids": [],
  "professional_issue_ids": [],
  "missing_review_dependencies": [],
  "can_enter_formal_review": true,
  "package_type": "professional_design_package",
  "review_status": "formal-review-ready",
  "next_actions": [],
  "schema_version": "0.1.0",
  "checks": [
    {
      "check_id": "DETERMINISTIC_VALIDATION",
      "result": "pass",
      "severity": "blocking",
      "target": "validate_local_submission.py",
      "message": "deterministic_validation: PASS"
    },
    {
      "check_id": "SPATIAL_REVIEW",
      "result": "pass",
      "severity": "blocking",
      "target": "spatial_review.py",
      "message": "spatial_review: PASS"
    },
    {
      "check_id": "VISUAL_PACKAGING",
      "result": "pass",
      "severity": "blocking",
      "target": "visual_review.py",
      "message": "visual_review: PASS"
    },
    {
      "check_id": "PROFESSIONAL_EVIDENCE",
      "result": "pass",
      "severity": "blocking",
      "target": "professional_review.py",
      "message": "professional_review: PASS"
    }
  ]
}
