{
  "ok": true,
  "submission_dir": "submissions\\M-zyx-01\\ai-symbiotic-belt",
  "pr_author": "M-zyx-01",
  "stage": "formal",
  "deterministic_validation": {
    "returncode": 0,
    "ok": true,
    "stdout": {
      "ok": true,
      "errors": [],
      "warnings": [
        "submissions/M-zyx-01/ai-symbiotic-belt/manifest.json: known_blockers present; submission may pass intake but cannot enter formal professional scoring until resolved",
        "submissions/M-zyx-01/ai-symbiotic-belt/geometry/site_boundary.geojson: uses provisional boundary; do not treat it as an official redline or precise-area basis. Organizer data gaps do not block content scoring; recalculate when official geometry is supplied"
      ],
      "proposal_files": [
        "submissions/M-zyx-01/ai-symbiotic-belt/proposal.md"
      ],
      "changelog_files": [
        "submissions/M-zyx-01/ai-symbiotic-belt/changelog.md"
      ],
      "changed_files": [
        "submissions/M-zyx-01/ai-symbiotic-belt/agent.json",
        "submissions/M-zyx-01/ai-symbiotic-belt/assets/figures/key-areas.en.png",
        "submissions/M-zyx-01/ai-symbiotic-belt/assets/figures/key-areas.png",
        "submissions/M-zyx-01/ai-symbiotic-belt/assets/figures/land-use-structure.en.png",
        "submissions/M-zyx-01/ai-symbiotic-belt/assets/figures/land-use-structure.png",
        "submissions/M-zyx-01/ai-symbiotic-belt/assets/figures/metrics-evidence.en.png",
        "submissions/M-zyx-01/ai-symbiotic-belt/assets/figures/metrics-evidence.png",
        "submissions/M-zyx-01/ai-symbiotic-belt/assets/figures/mobility-bluegreen.en.png",
        "submissions/M-zyx-01/ai-symbiotic-belt/assets/figures/mobility-bluegreen.png",
        "submissions/M-zyx-01/ai-symbiotic-belt/assets/figures/site-overview.en.png",
        "submissions/M-zyx-01/ai-symbiotic-belt/assets/figures/site-overview.png",
        "submissions/M-zyx-01/ai-symbiotic-belt/assumptions.json",
        "submissions/M-zyx-01/ai-symbiotic-belt/changelog.md",
        "submissions/M-zyx-01/ai-symbiotic-belt/compliance_matrix.json",
        "submissions/M-zyx-01/ai-symbiotic-belt/design_depth_matrix.json",
        "submissions/M-zyx-01/ai-symbiotic-belt/drawings/a0-boards.en.pdf",
        "submissions/M-zyx-01/ai-symbiotic-belt/drawings/a0-boards.pdf",
        "submissions/M-zyx-01/ai-symbiotic-belt/drawings/a3-booklet.en.pdf",
        "submissions/M-zyx-01/ai-symbiotic-belt/drawings/a3-booklet.pdf",
        "submissions/M-zyx-01/ai-symbiotic-belt/geometry/buildings.geojson",
        "submissions/M-zyx-01/ai-symbiotic-belt/geometry/constraints.geojson",
        "submissions/M-zyx-01/ai-symbiotic-belt/geometry/green_space.geojson",
        "submissions/M-zyx-01/ai-symbiotic-belt/geometry/key_areas.geojson",
        "submissions/M-zyx-01/ai-symbiotic-belt/geometry/land_use.geojson",
        "submissions/M-zyx-01/ai-symbiotic-belt/geometry/phasing.geojson",
        "submissions/M-zyx-01/ai-symbiotic-belt/geometry/public_space.geojson",
        "submissions/M-zyx-01/ai-symbiotic-belt/geometry/roads.geojson",
        "submissions/M-zyx-01/ai-symbiotic-belt/geometry/site_boundary.geojson",
        "submissions/M-zyx-01/ai-symbiotic-belt/manifest.json",
        "submissions/M-zyx-01/ai-symbiotic-belt/metrics.json",
        "submissions/M-zyx-01/ai-symbiotic-belt/proposal.en.md",
        "submissions/M-zyx-01/ai-symbiotic-belt/proposal.md",
        "submissions/M-zyx-01/ai-symbiotic-belt/report/copyright_statement.md",
        "submissions/M-zyx-01/ai-symbiotic-belt/report/proposal.en.html",
        "submissions/M-zyx-01/ai-symbiotic-belt/report/proposal.html",
        "submissions/M-zyx-01/ai-symbiotic-belt/self_check.json",
        "submissions/M-zyx-01/ai-symbiotic-belt/sources.json",
        "submissions/M-zyx-01/ai-symbiotic-belt/standard_matrix.json",
        "submissions/M-zyx-01/ai-symbiotic-belt/visual/index.en.html",
        "submissions/M-zyx-01/ai-symbiotic-belt/visual/index.html"
      ],
      "ai_package_stages": {
        "submissions/M-zyx-01/ai-symbiotic-belt": "formal"
      },
      "total_bytes": 4076135,
      "maintainer_bypass": false
    },
    "stderr": ""
  },
  "spatial_review": {
    "returncode": 0,
    "ok": true,
    "stdout": {
      "ok": true,
      "stage": "formal",
      "issues": [
        {
          "check_id": "KEY_AREA_PROVISIONAL",
          "severity": "minor",
          "target_file": "geometry/key_areas.geojson",
          "message": "Key detailed-design area is provisional; do not use it as an official redline or precise-area basis. Content scoring remains eligible.",
          "target_feature_id": "PROV-KEY-001",
          "expected": null,
          "actual": null
        },
        {
          "check_id": "KEY_AREA_PROVISIONAL",
          "severity": "minor",
          "target_file": "geometry/key_areas.geojson",
          "message": "Key detailed-design area is provisional; do not use it as an official redline or precise-area basis. Content scoring remains eligible.",
          "target_feature_id": "PROV-KEY-002",
          "expected": null,
          "actual": null
        },
        {
          "check_id": "KEY_AREA_PROVISIONAL",
          "severity": "minor",
          "target_file": "geometry/key_areas.geojson",
          "message": "Key detailed-design area is provisional; do not use it as an official redline or precise-area basis. Content scoring remains eligible.",
          "target_feature_id": "PROV-KEY-003",
          "expected": null,
          "actual": null
        }
      ],
      "metrics": {
        "site_area_sqm": 11419439.442,
        "green_space_area_sqm": 2052866.474,
        "public_space_area_sqm": 235232.653,
        "building_footprint_area_sqm": 0.0,
        "green_ratio": 0.179769,
        "public_space_ratio": 0.020599
      }
    },
    "stderr": ""
  },
  "visual_review": {
    "returncode": 0,
    "ok": true,
    "stdout": {
      "ok": true,
      "issues": [],
      "metrics_seen": {
        "site_area_sqm": 11419439.442,
        "key_area_count": 3.0,
        "green_ratio": 0.179769,
        "public_space_ratio": 0.020599,
        "scenario_card_count": 10.0,
        "ai_landmark_count": 3.0
      }
    },
    "stderr": ""
  },
  "professional_review": {
    "returncode": 0,
    "ok": true,
    "stdout": {
      "ok": true,
      "issues": [],
      "summary": {
        "standard_matrix_items": 6,
        "design_depth_items": 15,
        "known_metric_refs_required": 23,
        "proposal_format_version": "2",
        "evidence_contract": "section-anchors-plus-structured-audit",
        "proposal_reference_counts": {
          "source": 6,
          "standard": 4,
          "depth": 9,
          "data": 11,
          "metric": 3
        }
      }
    },
    "stderr": ""
  },
  "spatial_issue_ids": [
    "KEY_AREA_PROVISIONAL",
    "KEY_AREA_PROVISIONAL",
    "KEY_AREA_PROVISIONAL"
  ],
  "visual_issue_ids": [],
  "professional_issue_ids": [],
  "missing_review_dependencies": [],
  "can_enter_formal_review": true,
  "package_type": "professional_design_package",
  "review_status": "formal-review-ready",
  "next_actions": [
    "Resolve formal-readiness warning: submissions/M-zyx-01/ai-symbiotic-belt/manifest.json: known_blockers present; submission may pass intake but cannot enter formal professional scoring until resolved"
  ],
  "schema_version": "0.1.0",
  "checks": [
    {
      "check_id": "DETERMINISTIC_VALIDATION",
      "result": "pass",
      "severity": "blocking",
      "target": "validate_local_submission.py",
      "message": "deterministic_validation: PASS"
    },
    {
      "check_id": "SPATIAL_REVIEW",
      "result": "pass",
      "severity": "blocking",
      "target": "spatial_review.py",
      "message": "spatial_review: PASS"
    },
    {
      "check_id": "VISUAL_PACKAGING",
      "result": "pass",
      "severity": "blocking",
      "target": "visual_review.py",
      "message": "visual_review: PASS"
    },
    {
      "check_id": "PROFESSIONAL_EVIDENCE",
      "result": "pass",
      "severity": "blocking",
      "target": "professional_review.py",
      "message": "professional_review: PASS"
    }
  ]
}
