{
  "ok": true,
  "submission_dir": "submissions\\Zhen-WushuiLingchun\\jingzhang-in-phase",
  "pr_author": "Zhen-WushuiLingchun",
  "stage": "formal",
  "deterministic_validation": {
    "returncode": 0,
    "ok": true,
    "stdout": {
      "ok": true,
      "errors": [],
      "warnings": [
        "submissions/Zhen-WushuiLingchun/jingzhang-in-phase/proposal.md: 可能涉及非公开或敏感资料; maintainer review required",
        "submissions/Zhen-WushuiLingchun/jingzhang-in-phase/geometry/site_boundary.geojson: uses provisional boundary; do not treat it as an official redline or precise-area basis. Organizer data gaps do not block content scoring; recalculate when official geometry is supplied"
      ],
      "proposal_files": [
        "submissions/Zhen-WushuiLingchun/jingzhang-in-phase/proposal.md"
      ],
      "changelog_files": [
        "submissions/Zhen-WushuiLingchun/jingzhang-in-phase/changelog.md"
      ],
      "changed_files": [
        "submissions/Zhen-WushuiLingchun/jingzhang-in-phase/agent.json",
        "submissions/Zhen-WushuiLingchun/jingzhang-in-phase/assets/figures/key-areas.en.png",
        "submissions/Zhen-WushuiLingchun/jingzhang-in-phase/assets/figures/key-areas.png",
        "submissions/Zhen-WushuiLingchun/jingzhang-in-phase/assets/figures/land-use-structure.en.png",
        "submissions/Zhen-WushuiLingchun/jingzhang-in-phase/assets/figures/land-use-structure.png",
        "submissions/Zhen-WushuiLingchun/jingzhang-in-phase/assets/figures/metrics-evidence.en.png",
        "submissions/Zhen-WushuiLingchun/jingzhang-in-phase/assets/figures/metrics-evidence.png",
        "submissions/Zhen-WushuiLingchun/jingzhang-in-phase/assets/figures/mobility-bluegreen.en.png",
        "submissions/Zhen-WushuiLingchun/jingzhang-in-phase/assets/figures/mobility-bluegreen.png",
        "submissions/Zhen-WushuiLingchun/jingzhang-in-phase/assets/figures/site-overview.en.png",
        "submissions/Zhen-WushuiLingchun/jingzhang-in-phase/assets/figures/site-overview.png",
        "submissions/Zhen-WushuiLingchun/jingzhang-in-phase/assumptions.json",
        "submissions/Zhen-WushuiLingchun/jingzhang-in-phase/changelog.md",
        "submissions/Zhen-WushuiLingchun/jingzhang-in-phase/compliance_matrix.json",
        "submissions/Zhen-WushuiLingchun/jingzhang-in-phase/design_depth_matrix.json",
        "submissions/Zhen-WushuiLingchun/jingzhang-in-phase/drawings/a0-boards.en.pdf",
        "submissions/Zhen-WushuiLingchun/jingzhang-in-phase/drawings/a0-boards.pdf",
        "submissions/Zhen-WushuiLingchun/jingzhang-in-phase/drawings/a3-booklet.en.pdf",
        "submissions/Zhen-WushuiLingchun/jingzhang-in-phase/drawings/a3-booklet.pdf",
        "submissions/Zhen-WushuiLingchun/jingzhang-in-phase/geometry/buildings.geojson",
        "submissions/Zhen-WushuiLingchun/jingzhang-in-phase/geometry/constraints.geojson",
        "submissions/Zhen-WushuiLingchun/jingzhang-in-phase/geometry/green_space.geojson",
        "submissions/Zhen-WushuiLingchun/jingzhang-in-phase/geometry/key_areas.geojson",
        "submissions/Zhen-WushuiLingchun/jingzhang-in-phase/geometry/land_use.geojson",
        "submissions/Zhen-WushuiLingchun/jingzhang-in-phase/geometry/phasing.geojson",
        "submissions/Zhen-WushuiLingchun/jingzhang-in-phase/geometry/public_space.geojson",
        "submissions/Zhen-WushuiLingchun/jingzhang-in-phase/geometry/roads.geojson",
        "submissions/Zhen-WushuiLingchun/jingzhang-in-phase/geometry/site_boundary.geojson",
        "submissions/Zhen-WushuiLingchun/jingzhang-in-phase/manifest.json",
        "submissions/Zhen-WushuiLingchun/jingzhang-in-phase/metrics.json",
        "submissions/Zhen-WushuiLingchun/jingzhang-in-phase/proposal.en.md",
        "submissions/Zhen-WushuiLingchun/jingzhang-in-phase/proposal.md",
        "submissions/Zhen-WushuiLingchun/jingzhang-in-phase/report/copyright_statement.md",
        "submissions/Zhen-WushuiLingchun/jingzhang-in-phase/report/narrative.md",
        "submissions/Zhen-WushuiLingchun/jingzhang-in-phase/report/proposal.en.html",
        "submissions/Zhen-WushuiLingchun/jingzhang-in-phase/report/proposal.html",
        "submissions/Zhen-WushuiLingchun/jingzhang-in-phase/risk.json",
        "submissions/Zhen-WushuiLingchun/jingzhang-in-phase/self_check.json",
        "submissions/Zhen-WushuiLingchun/jingzhang-in-phase/sources.json",
        "submissions/Zhen-WushuiLingchun/jingzhang-in-phase/standard_matrix.json",
        "submissions/Zhen-WushuiLingchun/jingzhang-in-phase/visual/index.en.html",
        "submissions/Zhen-WushuiLingchun/jingzhang-in-phase/visual/index.html"
      ],
      "ai_package_stages": {
        "submissions/Zhen-WushuiLingchun/jingzhang-in-phase": "formal"
      },
      "total_bytes": 28770379,
      "maintainer_bypass": false
    },
    "stderr": ""
  },
  "spatial_review": {
    "returncode": 0,
    "ok": true,
    "stdout": {
      "ok": true,
      "stage": "formal",
      "issues": [
        {
          "check_id": "KEY_AREA_PROVISIONAL",
          "severity": "minor",
          "target_file": "geometry/key_areas.geojson",
          "message": "Key detailed-design area is provisional; do not use it as an official redline or precise-area basis. Content scoring remains eligible.",
          "target_feature_id": "PROV-KEY-001",
          "expected": null,
          "actual": null
        },
        {
          "check_id": "KEY_AREA_PROVISIONAL",
          "severity": "minor",
          "target_file": "geometry/key_areas.geojson",
          "message": "Key detailed-design area is provisional; do not use it as an official redline or precise-area basis. Content scoring remains eligible.",
          "target_feature_id": "PROV-KEY-002",
          "expected": null,
          "actual": null
        },
        {
          "check_id": "KEY_AREA_PROVISIONAL",
          "severity": "minor",
          "target_file": "geometry/key_areas.geojson",
          "message": "Key detailed-design area is provisional; do not use it as an official redline or precise-area basis. Content scoring remains eligible.",
          "target_feature_id": "PROV-KEY-003",
          "expected": null,
          "actual": null
        }
      ],
      "metrics": {
        "site_area_sqm": 11412825.386,
        "green_space_area_sqm": 1880464.722,
        "public_space_area_sqm": 522548.979,
        "building_footprint_area_sqm": 573875.0,
        "green_ratio": 0.164768,
        "public_space_ratio": 0.045786
      }
    },
    "stderr": ""
  },
  "visual_review": {
    "returncode": 0,
    "ok": true,
    "stdout": {
      "ok": true,
      "issues": [],
      "metrics_seen": {
        "site_area_sqm": 11412825.385554,
        "green_ratio": 0.164768,
        "public_space_ratio": 0.045786
      }
    },
    "stderr": ""
  },
  "professional_review": {
    "returncode": 0,
    "ok": true,
    "stdout": {
      "ok": true,
      "issues": [],
      "summary": {
        "standard_matrix_items": 6,
        "design_depth_items": 15,
        "known_metric_refs_required": 14,
        "proposal_format_version": "2",
        "evidence_contract": "section-anchors-plus-structured-audit",
        "proposal_reference_counts": {
          "source": 12,
          "standard": 4,
          "depth": 11,
          "data": 10,
          "metric": 9
        }
      }
    },
    "stderr": ""
  },
  "spatial_issue_ids": [
    "KEY_AREA_PROVISIONAL",
    "KEY_AREA_PROVISIONAL",
    "KEY_AREA_PROVISIONAL"
  ],
  "visual_issue_ids": [],
  "professional_issue_ids": [],
  "missing_review_dependencies": [],
  "can_enter_formal_review": true,
  "package_type": "professional_design_package",
  "review_status": "formal-review-ready",
  "next_actions": [],
  "schema_version": "0.1.0",
  "checks": [
    {
      "check_id": "DETERMINISTIC_VALIDATION",
      "result": "pass",
      "severity": "blocking",
      "target": "validate_local_submission.py",
      "message": "deterministic_validation: PASS"
    },
    {
      "check_id": "SPATIAL_REVIEW",
      "result": "pass",
      "severity": "blocking",
      "target": "spatial_review.py",
      "message": "spatial_review: PASS"
    },
    {
      "check_id": "VISUAL_PACKAGING",
      "result": "pass",
      "severity": "blocking",
      "target": "visual_review.py",
      "message": "visual_review: PASS"
    },
    {
      "check_id": "PROFESSIONAL_EVIDENCE",
      "result": "pass",
      "severity": "blocking",
      "target": "professional_review.py",
      "message": "professional_review: PASS"
    }
  ]
}
